{
  "schema_version": "0.3.0",
  "document_type": "point_bindings",
  "generated_at": "2026-08-06T18:51:57Z",
  "registry_id": "homestead.primary.v0_3",
  "bindings": [
    {
      "point_id": "energy.battery_bank.power_container.01/soc_pct",
      "asset_id": "energy.battery_bank.power_container.01",
      "point_name": "soc_pct",
      "binding_status": "tbd",
      "source_protocol": "modbus_tcp_or_bms_gateway_TBD",
      "source_address": "TBD",
      "sample_interval_s": 2,
      "publish_interval_s": 5,
      "stale_after_s": 20,
      "historian_policy": "high_resolution",
      "quality_policy": "reject_invalid",
      "automatic_control_allowed": true,
      "notes": []
    },
    {
      "point_id": "energy.battery_bank.power_container.01/soh_pct",
      "asset_id": "energy.battery_bank.power_container.01",
      "point_name": "soh_pct",
      "binding_status": "tbd",
      "source_protocol": "modbus_tcp_or_bms_gateway_TBD",
      "source_address": "TBD",
      "sample_interval_s": 2,
      "publish_interval_s": 5,
      "stale_after_s": 20,
      "historian_policy": "high_resolution",
      "quality_policy": "reject_invalid",
      "automatic_control_allowed": false,
      "notes": []
    },
    {
      "point_id": "energy.battery_bank.power_container.01/power_kw",
      "asset_id": "energy.battery_bank.power_container.01",
      "point_name": "power_kw",
      "binding_status": "tbd",
      "source_protocol": "modbus_tcp_or_bms_gateway_TBD",
      "source_address": "TBD",
      "sample_interval_s": 2,
      "publish_interval_s": 5,
      "stale_after_s": 20,
      "historian_policy": "high_resolution",
      "quality_policy": "reject_invalid",
      "automatic_control_allowed": true,
      "notes": []
    },
    {
      "point_id": "energy.battery_bank.power_container.01/energy_available_kwh",
      "asset_id": "energy.battery_bank.power_container.01",
      "point_name": "energy_available_kwh",
      "binding_status": "tbd",
      "source_protocol": "modbus_tcp_or_bms_gateway_TBD",
      "source_address": "TBD",
      "sample_interval_s": 2,
      "publish_interval_s": 5,
      "stale_after_s": 20,
      "historian_policy": "high_resolution",
      "quality_policy": "reject_invalid",
      "automatic_control_allowed": true,
      "notes": []
    },
    {
      "point_id": "energy.battery_bank.power_container.01/temperature_cell_max_c",
      "asset_id": "energy.battery_bank.power_container.01",
      "point_name": "temperature_cell_max_c",
      "binding_status": "tbd",
      "source_protocol": "modbus_tcp_or_bms_gateway_TBD",
      "source_address": "TBD",
      "sample_interval_s": 2,
      "publish_interval_s": 5,
      "stale_after_s": 20,
      "historian_policy": "high_resolution",
      "quality_policy": "reject_invalid",
      "automatic_control_allowed": true,
      "notes": []
    },
    {
      "point_id": "energy.battery_bank.power_container.01/charge_limit_kw",
      "asset_id": "energy.battery_bank.power_container.01",
      "point_name": "charge_limit_kw",
      "binding_status": "tbd",
      "source_protocol": "modbus_tcp_or_bms_gateway_TBD",
      "source_address": "TBD",
      "sample_interval_s": 2,
      "publish_interval_s": 5,
      "stale_after_s": 20,
      "historian_policy": "high_resolution",
      "quality_policy": "reject_invalid",
      "automatic_control_allowed": true,
      "notes": []
    },
    {
      "point_id": "energy.battery_bank.power_container.01/discharge_limit_kw",
      "asset_id": "energy.battery_bank.power_container.01",
      "point_name": "discharge_limit_kw",
      "binding_status": "tbd",
      "source_protocol": "modbus_tcp_or_bms_gateway_TBD",
      "source_address": "TBD",
      "sample_interval_s": 2,
      "publish_interval_s": 5,
      "stale_after_s": 20,
      "historian_policy": "high_resolution",
      "quality_policy": "reject_invalid",
      "automatic_control_allowed": true,
      "notes": []
    },
    {
      "point_id": "energy.battery_bank.power_container.01/charge_permissive",
      "asset_id": "energy.battery_bank.power_container.01",
      "point_name": "charge_permissive",
      "binding_status": "tbd",
      "source_protocol": "modbus_tcp_or_bms_gateway_TBD",
      "source_address": "TBD",
      "sample_interval_s": 2,
      "publish_interval_s": 5,
      "stale_after_s": 20,
      "historian_policy": "high_resolution",
      "quality_policy": "reject_invalid",
      "automatic_control_allowed": true,
      "notes": []
    },
    {
      "point_id": "energy.battery_bank.power_container.01/discharge_permissive",
      "asset_id": "energy.battery_bank.power_container.01",
      "point_name": "discharge_permissive",
      "binding_status": "tbd",
      "source_protocol": "modbus_tcp_or_bms_gateway_TBD",
      "source_address": "TBD",
      "sample_interval_s": 2,
      "publish_interval_s": 5,
      "stale_after_s": 20,
      "historian_policy": "high_resolution",
      "quality_policy": "reject_invalid",
      "automatic_control_allowed": true,
      "notes": []
    },
    {
      "point_id": "energy.battery_bank.power_container.01/contactor_state",
      "asset_id": "energy.battery_bank.power_container.01",
      "point_name": "contactor_state",
      "binding_status": "tbd",
      "source_protocol": "modbus_tcp_or_bms_gateway_TBD",
      "source_address": "TBD",
      "sample_interval_s": 2,
      "publish_interval_s": 5,
      "stale_after_s": 20,
      "historian_policy": "high_resolution",
      "quality_policy": "reject_invalid",
      "automatic_control_allowed": false,
      "notes": []
    },
    {
      "point_id": "energy.battery_bank.power_container.01/fault_active",
      "asset_id": "energy.battery_bank.power_container.01",
      "point_name": "fault_active",
      "binding_status": "tbd",
      "source_protocol": "modbus_tcp_or_bms_gateway_TBD",
      "source_address": "TBD",
      "sample_interval_s": 2,
      "publish_interval_s": 5,
      "stale_after_s": 20,
      "historian_policy": "high_resolution",
      "quality_policy": "reject_invalid",
      "automatic_control_allowed": false,
      "notes": []
    },
    {
      "point_id": "energy.battery_bank.power_container.01/fault_code",
      "asset_id": "energy.battery_bank.power_container.01",
      "point_name": "fault_code",
      "binding_status": "tbd",
      "source_protocol": "modbus_tcp_or_bms_gateway_TBD",
      "source_address": "TBD",
      "sample_interval_s": 2,
      "publish_interval_s": 5,
      "stale_after_s": 20,
      "historian_policy": "high_resolution",
      "quality_policy": "reject_invalid",
      "automatic_control_allowed": false,
      "notes": []
    },
    {
      "point_id": "energy.inverter.power_container.01/power_ac_output_kw",
      "asset_id": "energy.inverter.power_container.01",
      "point_name": "power_ac_output_kw",
      "binding_status": "tbd",
      "source_protocol": "modbus_tcp_or_vendor_api_TBD",
      "source_address": "TBD",
      "sample_interval_s": 2,
      "publish_interval_s": 5,
      "stale_after_s": 20,
      "historian_policy": "high_resolution",
      "quality_policy": "reject_invalid",
      "automatic_control_allowed": true,
      "notes": []
    },
    {
      "point_id": "energy.inverter.power_container.01/power_dc_input_kw",
      "asset_id": "energy.inverter.power_container.01",
      "point_name": "power_dc_input_kw",
      "binding_status": "tbd",
      "source_protocol": "modbus_tcp_or_vendor_api_TBD",
      "source_address": "TBD",
      "sample_interval_s": 2,
      "publish_interval_s": 5,
      "stale_after_s": 20,
      "historian_policy": "high_resolution",
      "quality_policy": "reject_invalid",
      "automatic_control_allowed": false,
      "notes": []
    },
    {
      "point_id": "energy.inverter.power_container.01/voltage_ac_v",
      "asset_id": "energy.inverter.power_container.01",
      "point_name": "voltage_ac_v",
      "binding_status": "tbd",
      "source_protocol": "modbus_tcp_or_vendor_api_TBD",
      "source_address": "TBD",
      "sample_interval_s": 2,
      "publish_interval_s": 5,
      "stale_after_s": 20,
      "historian_policy": "high_resolution",
      "quality_policy": "reject_invalid",
      "automatic_control_allowed": false,
      "notes": []
    },
    {
      "point_id": "energy.inverter.power_container.01/frequency_hz",
      "asset_id": "energy.inverter.power_container.01",
      "point_name": "frequency_hz",
      "binding_status": "tbd",
      "source_protocol": "modbus_tcp_or_vendor_api_TBD",
      "source_address": "TBD",
      "sample_interval_s": 2,
      "publish_interval_s": 5,
      "stale_after_s": 20,
      "historian_policy": "high_resolution",
      "quality_policy": "reject_invalid",
      "automatic_control_allowed": false,
      "notes": []
    },
    {
      "point_id": "energy.inverter.power_container.01/state_operating",
      "asset_id": "energy.inverter.power_container.01",
      "point_name": "state_operating",
      "binding_status": "tbd",
      "source_protocol": "modbus_tcp_or_vendor_api_TBD",
      "source_address": "TBD",
      "sample_interval_s": 2,
      "publish_interval_s": 5,
      "stale_after_s": 20,
      "historian_policy": "high_resolution",
      "quality_policy": "reject_invalid",
      "automatic_control_allowed": true,
      "notes": []
    },
    {
      "point_id": "energy.inverter.power_container.01/fault_active",
      "asset_id": "energy.inverter.power_container.01",
      "point_name": "fault_active",
      "binding_status": "tbd",
      "source_protocol": "modbus_tcp_or_vendor_api_TBD",
      "source_address": "TBD",
      "sample_interval_s": 2,
      "publish_interval_s": 5,
      "stale_after_s": 20,
      "historian_policy": "high_resolution",
      "quality_policy": "reject_invalid",
      "automatic_control_allowed": true,
      "notes": []
    },
    {
      "point_id": "energy.inverter.power_container.01/fault_code",
      "asset_id": "energy.inverter.power_container.01",